{
  "metadata": {
    "crop_id": "rubber",
    "name": "Rubber (Hevea brasiliensis)",
    "scientific_name": "Hevea brasiliensis",
    "category": "tree_crop",
    "crop_cycle_type": "perennial",
    "typical_duration_days": 2190,
    "regions": [
      "Nigeria - South-South",
      "Nigeria - South-East"
    ],
    "current_version": "1.1.0"
  },
  "growth_stages": [
    {
      "stage_id": "immature_girth_development",
      "name": "Immature (Girth Development)",
      "starts_day_after_planting": 0,
      "ends_day_after_planting": 2190,
      "description": "Years 0-6. Girth builds toward the ~50cm tapping threshold. Day 0 is transplanting of budded stumps/poly-bag plants, NOT seed sowing -- see operations for why this crop has no on-farm nursery_establishment operation, unlike cocoa.json/oil_palm.json."
    },
    {
      "stage_id": "tapping_yielding",
      "name": "Tapping (Yielding) Phase",
      "starts_day_after_planting": 2191,
      "ends_day_after_planting": 9125,
      "description": "Years 7-25+. Daily/frequent tapping management once girth threshold is reached."
    }
  ],
  "operations": [
    {
      "operation_id": "land_clearing",
      "name": "Land Clearing & Lining",
      "category": "land_prep",
      "description": "Clearing and lining deep, well-drained soils.",
      "requires_evidence": true,
      "can_repeat": false
    },
    {
      "operation_id": "planting_material_sourcing",
      "name": "Planting Material Sourcing",
      "category": "land_prep",
      "description": "STRUCTURAL NOTE, distinct from cocoa.json/oil_palm.json: the source ruleset describes rubber planting material as budded stumps or poly-bag plants of a proven clone (RRIM 600, GT 1, NIG-800/RRIN) sourced from a CERTIFIED NURSERY -- i.e. an external supplier, not something the farmer raises on their own plot. There is deliberately no nursery_establishment operation in this crop file for that reason, and no nursery-duration validation_rule either, since the source gives no farmer-loggable timing threshold for a stage the farmer doesn't perform. This is a genuine crop-type difference, not an oversight.",
      "requires_evidence": false,
      "can_repeat": false,
      "optional": true
    },
    {
      "operation_id": "cover_crop_establishment",
      "name": "Legume Cover Crop Establishment",
      "category": "land_prep",
      "description": "Establishing a legume cover crop alongside site preparation.",
      "requires_evidence": false,
      "can_repeat": false,
      "optional": true
    },
    {
      "operation_id": "transplanting",
      "name": "Transplanting",
      "category": "planting",
      "description": "Transplanting budded stumps/poly-bag plants at ~6m x 3m spacing (~450-550 trees/ha). This is day 0 of the field lifecycle.",
      "requires_evidence": true,
      "can_repeat": false
    },
    {
      "operation_id": "weeding",
      "name": "Circle Weeding",
      "category": "crop_management",
      "description": "Weed-circle maintenance and cover-crop upkeep.",
      "requires_evidence": false,
      "can_repeat": true,
      "optional": true
    },
    {
      "operation_id": "girth_monitoring",
      "name": "Girth Monitoring",
      "category": "crop_management",
      "description": "Monitoring trunk girth toward the ~50cm tapping-readiness threshold. Informational/observational -- no validation_rule is attached to this operation, since the source ruleset's actual enforceable gate is the tapping floor/warning below (tapping_r_floor/early_warn), which is time-based (years since transplanting) rather than a girth measurement this schema has no field for.",
      "requires_evidence": false,
      "can_repeat": true,
      "optional": true
    },
    {
      "operation_id": "pest_disease_control",
      "name": "Pest & Disease Control",
      "category": "pest_disease_control",
      "description": "White Root Rot and leaf-fall disease management.",
      "requires_evidence": false,
      "can_repeat": true,
      "optional": true
    },
    {
      "operation_id": "tapping",
      "name": "Tapping",
      "category": "harvest",
      "description": "Latex tapping using D3/D4 systems. Recurs many times per month for decades once mature -- no once-only rule, same pattern as cocoa.json/oil_palm.json's recurring harvest operations. NOTE: the source ruleset also specifies a tapping-FREQUENCY data-integrity rule here ('hard block if tapping is logged more than 20 days in a month; flag beyond 15') that this knowledge base's engine cannot implement -- this is the same rolling-window occurrence-count limitation already flagged for pepper.json's harvest-frequency rule (not the self-referential first-instance problem flagged for oil_palm.json's harvest-interval rule -- this is a genuinely different, also-unimplemented, limitation category). See version_history.",
      "requires_evidence": true,
      "can_repeat": true
    },
    {
      "operation_id": "stimulation",
      "name": "Ethephon Stimulation",
      "category": "input_application",
      "description": "Ethephon yield-stimulation application, restricted to older trees only. NOTE: the source ruleset also specifies a stimulation-FREQUENCY rule here ('flag beyond 4 applications/year') that has the same rolling-window occurrence-count limitation as the tapping-frequency rule above -- not implemented, see version_history. Only the age-gate half of this rule (trees under 10 years) is implemented in validation_rules, since that part IS a standard day-offset check.",
      "requires_evidence": true,
      "can_repeat": true,
      "optional": true
    }
  ],
  "workflow": [
    {
      "step_number": 1,
      "operation_id": "land_clearing",
      "required": false
    },
    {
      "step_number": 2,
      "operation_id": "planting_material_sourcing",
      "required": false
    },
    {
      "step_number": 3,
      "operation_id": "cover_crop_establishment",
      "required": false
    },
    {
      "step_number": 4,
      "operation_id": "transplanting",
      "required": false
    },
    {
      "step_number": 5,
      "operation_id": "weeding",
      "required": false,
      "repeat_until": null
    },
    {
      "step_number": 6,
      "operation_id": "girth_monitoring",
      "required": false,
      "repeat_until": null
    },
    {
      "step_number": 7,
      "operation_id": "pest_disease_control",
      "required": false,
      "repeat_until": null
    },
    {
      "step_number": 8,
      "operation_id": "tapping",
      "required": true,
      "repeat_until": null
    },
    {
      "step_number": 9,
      "operation_id": "stimulation",
      "required": false,
      "repeat_until": null
    }
  ],
  "validation_rules": [
    {
      "rule_id": "rubber_r_land_clearing_gate",
      "operation_id": "planting_material_sourcing",
      "depends_on_operation_id": "land_clearing",
      "min_days_after_dependency": 1,
      "max_days_after_dependency": 60,
      "can_repeat": false,
      "allow_backdate": false,
      "severity": "warning",
      "condition": "PLATFORM BUGFIX: this dependency rule did not exist at all in the original file, meaning planting_material_sourcing could previously be logged with NO land_clearing in history whatsoever. Added in response to a real bug the user found (land preparation stages should not be skippable or same-day relative to what precedes them) -- warning rather than block severity here to match the severity level cocoa.json's equivalent land_clearing -> nursery_establishment rule already used, since establishing nursery stock somewhat in parallel with site prep is more defensible for tree crops than skipping land prep entirely before planting a field crop.",
      "source": "N/A -- internal platform bugfix, not new agronomic sourcing. Pattern and max-day window (60 days) matches cocoa.json's existing analogous rule (cocoa_r1)."
    },
    {
      "rule_id": "rubber_r_tapping_floor",
      "operation_id": "tapping",
      "depends_on_operation_id": "transplanting",
      "min_days_after_dependency": 1825,
      "max_days_after_dependency": null,
      "can_repeat": true,
      "allow_backdate": false,
      "severity": "block",
      "condition": "Hard block before 5 years (60 months) -- early tapping stunts the tree permanently. Converted using the source's own stated year-equivalent (5 years = 1825 days at 365 days/year) rather than an approximated 30-day-per-month conversion, since the source itself gives both the month and year figure as equivalent here, unlike oil_palm.json's nursery rule, which only gave months. Applies only when the planting is recorded: an orchard established before it was entered here is not blocked for lacking it.",
      "source": "AgTrail Master Agronomist & Validator Ruleset, Agrolinking Solutions Ltd., July 2026, Section 18 (Rubber), Stage 4.",
      "required_dependency": false
    },
    {
      "rule_id": "rubber_r_tapping_early_warn",
      "operation_id": "tapping",
      "depends_on_operation_id": "transplanting",
      "min_days_after_dependency": 2190,
      "max_days_after_dependency": null,
      "can_repeat": true,
      "allow_backdate": false,
      "severity": "warning",
      "condition": "Flag before 6 years (72 months / 2190 days). Sits above the 5-year hard-block floor. Applies only when the planting is recorded: an orchard established before it was entered here is not blocked for lacking it.",
      "source": "AgTrail Master Agronomist & Validator Ruleset, Agrolinking Solutions Ltd., July 2026, Section 18 (Rubber), Stage 4.",
      "required_dependency": false
    },
    {
      "rule_id": "rubber_r_tapping_frequency_block",
      "operation_id": "tapping",
      "depends_on_operation_id": null,
      "max_occurrences": 20,
      "occurrence_window_days": 30,
      "can_repeat": true,
      "allow_backdate": false,
      "severity": "block",